{
  "id": "22222222-2222-4222-8222-222222222207",
  "user_id": "11111111-1111-4111-8111-111111111101",
  "type": "metrics",
  "status": "draft",
  "source_kind": "health_screenshot",
  "source_ref": {
    "file_id": "33333333-3333-4333-8333-333333333307",
    "telegram_update_id": 9007,
    "telegram_message_id": 48,
    "label": "metrics without date and unit"
  },
  "occurred_at": "2026-09-16T11:30:00Z",
  "created_at": "2026-09-16T11:31:00Z",
  "updated_at": "2026-09-16T11:31:00Z",
  "revision": 1,
  "payload": {
    "code": "steps",
    "value": 5000,
    "unit": null
  },
  "field_origins": {
    "code": "extracted",
    "value": "extracted"
  },
  "submission_id": null
}
