{
  "id": "22222222-2222-4222-8222-222222222201",
  "user_id": "11111111-1111-4111-8111-111111111101",
  "type": "meal",
  "status": "confirmed",
  "source_kind": "food_photo",
  "source_ref": {
    "file_id": "33333333-3333-4333-8333-333333333301",
    "telegram_update_id": 9001,
    "telegram_message_id": 42,
    "label": "food photo"
  },
  "occurred_at": "2026-09-16T11:30:00Z",
  "created_at": "2026-09-16T11:31:00Z",
  "updated_at": "2026-09-16T11:35:00Z",
  "revision": 3,
  "payload": {
    "description": "Oatmeal with berries",
    "mass_g": 200,
    "nutrients": {
      "energy_kcal": 165,
      "protein_g": 10,
      "fat_g": 5,
      "carbs_g": 20
    },
    "nutrients_basis": "per_100g"
  },
  "field_origins": {
    "description": "estimated",
    "mass_g": "reported",
    "nutrients.energy_kcal": "computed",
    "nutrients.protein_g": "computed",
    "nutrients.fat_g": "computed",
    "nutrients.carbs_g": "computed",
    "nutrients_basis": "reported"
  },
  "submission_id": "sub_meal_01"
}
