{
  "id": "22222222-2222-4222-8222-222222222204",
  "user_id": "11111111-1111-4111-8111-111111111101",
  "type": "checkin",
  "status": "confirmed",
  "source_kind": "quick_checkin",
  "source_ref": {
    "file_id": null,
    "telegram_update_id": 9004,
    "telegram_message_id": 45,
    "label": "quick checkin"
  },
  "occurred_at": "2026-09-16T07:00:00Z",
  "created_at": "2026-09-16T07:00:01Z",
  "updated_at": "2026-09-16T07:00:01Z",
  "revision": 1,
  "payload": {
    "category": "mood",
    "score": 4
  },
  "field_origins": {
    "category": "reported",
    "score": "reported"
  },
  "submission_id": "sub_checkin_mood_01"
}
