{
  "id": "22222222-2222-4222-8222-222222222202",
  "user_id": "11111111-1111-4111-8111-111111111101",
  "type": "meal",
  "status": "draft",
  "source_kind": "food_photo",
  "source_ref": {
    "file_id": "33333333-3333-4333-8333-333333333302",
    "telegram_update_id": 9002,
    "telegram_message_id": 43,
    "label": "food photo pending review"
  },
  "occurred_at": "2026-09-16T12:00:00Z",
  "created_at": "2026-09-16T12:01:00Z",
  "updated_at": "2026-09-16T12:01:00Z",
  "revision": 1,
  "payload": {
    "description": "Pasta",
    "mass_g": null,
    "nutrients": {
      "energy_kcal": 450,
      "protein_g": null,
      "fat_g": null,
      "carbs_g": null
    },
    "nutrients_basis": "per_serving"
  },
  "field_origins": {
    "description": "estimated",
    "mass_g": "estimated",
    "nutrients.energy_kcal": "estimated",
    "nutrients.protein_g": "estimated",
    "nutrients.fat_g": "estimated",
    "nutrients.carbs_g": "estimated",
    "nutrients_basis": "estimated"
  },
  "submission_id": null
}
