{
  "id": "22222222-2222-4222-8222-222222222203",
  "user_id": "11111111-1111-4111-8111-111111111101",
  "type": "metrics",
  "status": "confirmed",
  "source_kind": "watch_photo",
  "source_ref": {
    "file_id": "33333333-3333-4333-8333-333333333303",
    "telegram_update_id": 9003,
    "telegram_message_id": 44,
    "label": "watch screen"
  },
  "occurred_at": "2026-09-16T06:10:00Z",
  "created_at": "2026-09-16T06:12:00Z",
  "updated_at": "2026-09-16T06:15:00Z",
  "revision": 2,
  "payload": {
    "code": "steps",
    "value": 8432,
    "unit": "count",
    "local_date": "2026-09-16",
    "local_time": null,
    "qualifier": null
  },
  "field_origins": {
    "code": "extracted",
    "value": "extracted",
    "unit": "extracted",
    "local_date": "extracted"
  },
  "submission_id": "sub_steps_01"
}
