{
  "id": "22222222-2222-4222-8222-222222222205",
  "user_id": "11111111-1111-4111-8111-111111111101",
  "type": "note",
  "status": "confirmed",
  "source_kind": "text",
  "source_ref": {
    "file_id": null,
    "telegram_update_id": 9005,
    "telegram_message_id": 46,
    "label": "free text note"
  },
  "occurred_at": "2026-09-16T18:20:00Z",
  "created_at": "2026-09-16T18:21:00Z",
  "updated_at": "2026-09-16T18:22:00Z",
  "revision": 2,
  "payload": {
    "text": "Felt tired after lunch; no structured meal parsed."
  },
  "field_origins": {
    "text": "reported"
  },
  "submission_id": "sub_note_01"
}
