{
  "id": "22222222-2222-4222-8222-222222222209",
  "user_id": "11111111-1111-4111-8111-111111111101",
  "type": "metrics",
  "status": "confirmed",
  "source_kind": "text",
  "source_ref": {
    "file_id": null,
    "telegram_update_id": 9009,
    "telegram_message_id": 49,
    "label": "explicit zero steps"
  },
  "occurred_at": "2026-09-16T20:00:00Z",
  "created_at": "2026-09-16T20:01:00Z",
  "updated_at": "2026-09-16T20:02:00Z",
  "revision": 2,
  "payload": {
    "code": "steps",
    "value": 0,
    "unit": "count",
    "local_date": "2026-09-16",
    "local_time": null,
    "qualifier": null
  },
  "field_origins": {
    "code": "reported",
    "value": "reported",
    "unit": "reported",
    "local_date": "reported"
  },
  "submission_id": "sub_zero_steps_01"
}
